{
  "project_name": "[project_plan.md]",
  "domain": "software/product",
  "target_audience": "business stakeholders",
  "tone": "professional",
  "value_proposition": "[project_plan",
  "product_capabilities": [
    "[project_plan",
    "# 智能图书管理系统",
    "智能图书管理系统面向学校与社区图书馆管理人员，提供图书入库、借阅登记、归还跟踪、库存统计和读者管理能力",
    "系统价值在于减少人工登记成本，提升图书流转透明度，并通过数据统计帮助管理员了解热门书籍和库存缺口",
    "- 图书信息维护与分类检索"
  ],
  "evidence_items": [
    {
      "evidence_id": "ev_1",
      "summary": "[project_plan",
      "source_refs": [
        "project_plan.md"
      ],
      "confidence": 0.7
    },
    {
      "evidence_id": "ev_2",
      "summary": "# 智能图书管理系统",
      "source_refs": [
        "project_plan.md"
      ],
      "confidence": 0.7
    },
    {
      "evidence_id": "ev_3",
      "summary": "智能图书管理系统面向学校与社区图书馆管理人员，提供图书入库、借阅登记、归还跟踪、库存统计和读者管理能力",
      "source_refs": [
        "project_plan.md"
      ],
      "confidence": 0.7
    },
    {
      "evidence_id": "ev_4",
      "summary": "系统价值在于减少人工登记成本，提升图书流转透明度，并通过数据统计帮助管理员了解热门书籍和库存缺口",
      "source_refs": [
        "project_plan.md"
      ],
      "confidence": 0.7
    },
    {
      "evidence_id": "ev_5",
      "summary": "- 图书信息维护与分类检索",
      "source_refs": [
        "project_plan.md"
      ],
      "confidence": 0.7
    }
  ],
  "image_inventory": [],
  "unsupported_claims": [],
  "warnings": [],
  "confidence": 0.72
}
