{
  "project_name": "Test Project",
  "domain": "software/product",
  "target_audience": "business stakeholders",
  "tone": "professional",
  "value_proposition": "A comprehensive solution for test scenarios.",
  "product_capabilities": [
    "Automated testing capability",
    "Data analysis and reporting",
    "User management system"
  ],
  "evidence_items": [
    {
      "evidence_id": "ev_1",
      "summary": "Project materials describe a software system.",
      "source_refs": [
        "input"
      ],
      "confidence": 0.8
    }
  ],
  "unsupported_claims": [],
  "warnings": [],
  "confidence": 0.85,
  "image_inventory": []
}
